,gene,driver_mut_cnt,gene_size,driver_mut_cnt_relative,permanova_pval,permdisp_pval,Mutations
0,E,7,75.0,0.09333333333333334,0.001,0.011,"T9I, L73F, V49L, V58F, R69I, V75L, T30I"
1,M,16,222.0,0.07207207207207207,0.001,0.265,"A63S, D209Y, Q19R, A98S, A63V, V23L, A81S, A142V, V70F, A85S, Q19H, A38S, M109I, A69S, W31C, D160Y"
2,N,68,419.0,0.162291169451074,0.001,0.391,"G30R, R32H, P13T, P13L, P13S, S413I, R32C, G30V, R14L, D402Y, Q389H, S33I, D399Y, A119S, D401Y, A182S, R209I, A254S, R10L, G34W, E31Q, G30A, T393I, G18V, A414S, A12S, W330L, M234I, Q9H, R191L, S193I, S202N, G30E, S33G, S33R, G204V, R32L, E31G, G204R, A90S, S33N, N11S, A254V, Q229H, A308S, A252S, A12V, D3Y, Q28H, S180I, A273S, R385I, A251S, Q239H, V270L, A152S, R195I, E253D, N196I, G19V, D103Y, S33C, N11I, S410F, S202I, G243C, D348Y, T205I"
3,ORF1ab,108,2695.0,0.04007421150278293,0.001,0.887,"A3070V, A3220V, A4835V, A5620S, A6914S, A5692S, A5833S, A5922S, A6044S, E1413D, E5136D, D5130Y, D5285Y, D6491Y, D6580Y, E6945D, E5314D, E5585D, F3085S, F5615C, F4272C, K6980N, K5110N, K5848N, G3072C, G392C, G6173V, H3076Y, K2497N, K2029N, K1280N, K6822N, K2622N, K4176N, K680N, K2511N, K4870N, M3934I, M3221I, L6334F, M1312I, L5030F, L4906F, L3027F, S6343I, Q607H, R3323C, R5716L, R5716C, R6138L, S2625F, S3675F, S2972F, M1378I, M3087I, M4241I, M4375V, M5753I, M4993I, M789I, M5900I, M5974I, M5997I, M6094I, M6818I, M7068I, P3395L, P1265L, P1265S, P3395S, Q5214H, P927L, T5036M, T1303I, T2967I, T3058I, T3255I, T3255A, T6564I, T3258I, S3564L, S3950F, S3732F, S5587F, V3976F, V3759F, V3660L, V2061F, T842I, T6846I, V5511L, V6212F, V6461F, V6518L, V6579F, V6624L, V4691F, V4722L, G6581V, H3233Y, K6768N, T3090I, A5770S, K714N, A1298V, G5530C, K3979N, K6274N"
4,ORF3a,46,275.0,0.16727272727272727,0.001,0.57,"A110S, A23S, A72S, E241*, G224C, G100C, R6I, T223I, W131C, L86F, A54S, P159S, A33S, V202L, V77F, R122I, R30L, G18C, G254*, W45L, V256F, V55F, V90F, R134L, A99S, W69L, C81F, V112F, D155Y, L85F, K67N, R126S, T151I, R68I, E239D, G224V, E242*, L147F, T223S, P262S, K66N, C133F, D142H, G187C, S171L, G172V"
5,ORF6,13,61.0,0.21311475409836064,0.001,0.007,"D61Y, R20S, W27L, V24F, R20K, E55*, E13D, D61H, D30Y, D53Y, D61N, D61G, T21I"
6,ORF7a,11,121.0,0.09090909090909091,0.001,0.933,"E121*, E16D, V104F, V24F, E22D, Q76H, G38V, V29L, V93F, S37F, R118I"
7,ORF8,6,121.0,0.049586776859504134,0.001,0.895,"A65S, E106*, V32L, D35Y, W45L, I121L"
8,ORF9b,39,,,0.001,0.467,"A29T, P10L, M26T, P10S, M26I, E27*, A29V, N28S, A11S, M8I, H9Q, R32L, R13L, V30L, S6I, E7*, E27D, E27Q, V15L, E86D, M8V, G38V, V30M, E27K, A29S, N28D, R25I, H9Y, D16Y, P10H, E27G, R13C, L14F, E27A, P10T, P10R, P10A, K4I, Q20*"
9,S,122,1273.0,0.09583660644147683,0.001,0.096,"D796H, D796Y, G339S, N679K, V213L, S477N, S477I, S373L, R408I, A27S, P384L, H655Y, K417N, E484Q, S373P, L858F, E484K, D796N, P1069S, G1167V, A879S, R21I, V308L, V401L, T719I, T859I, K1191N, M1237I, G446V, A845S, A27T, A27V, A419S, T376I, C1250F, A1078S, S711F, P25S, V534F, G1219C, N501Y, A243V, S477R, T941I, T478K, S477G, T478I, G339D, E484A, G1219V, E96D, A892S, L8F, P412L, G769V, P25L, A570D, P26S, D80Y, A372V, P812L, A846S, A520S, Q677H, V1228L, L24S, V143F, A262S, A1087S, V90F, W152C, L54F, K1073N, L141F, G232V, W1102L, P26L, C1235F, V622F, S12F, V1230L, D405Y, V1133F, R1091L, G769R, E484G, P681L, N501I, P174L, P681H, Q954L, Q498R, A653V, N501S, K417T, T22I, V213A, V213M, Y505H, P25T, V503F, D936Y, A243S, D1163Y, P479S, Q314K, S494L, V362F, D808G, D138Y, S982A, T19I, V826L, L849F, M731I, R102I, D138H, V1104L, R102S, A1022S, T716I, S297L"
10,nsp1,4,180.0,0.022222222222222223,0.001,0.941,"H110Y, K120N, G112C, V86F"
11,nsp10,2,139.0,0.014388489208633094,0.001,0.766,"M122V, F19C"
12,nsp12 (RdRp),17,932.0,0.018240343347639486,0.001,0.728,"A443V, D738Y, D893Y, E922D, E744D, L514F, Q822H, V330L, M601I, L638F, K718N, T644M, K478N, V588L, V299F, D879Y, M629I"
13,nsp13,15,601.0,0.024958402662229616,0.001,0.507,"A296S, A598S, S263F, R392C, R392L, M429I, F291C, A509S, M576I, G206C, K524N, E261D, A368S, A446S, V187L"
14,nsp14,15,527.0,0.028462998102466792,0.001,0.777,"A119S, G248V, M169I, M49I, M72I, S418I, R213L, V287F, K349N, L409F, Q354H, V312F, V290F, A274S, V125F"
15,nsp15,4,346.0,0.011560693641618497,0.001,0.942,"G129V, T112I, V127F, V66L"
16,nsp16,6,298.0,0.020134228187919462,0.001,0.901,"A116S, E147D, K182N, K24N, M20I, M270I"
17,nsp4,20,500.0,0.04,0.001,0.613,"A457V, F322S, H313Y, M458I, T492I, T204I, L264F, T495I, S209F, T295I, G309C, T492A, A307V, M324I, T327I, H470Y, T350I, L438P, L360F, N396T"
18,nsp5 (Mpro),17,306.0,0.05555555555555555,0.001,0.958,"P132L, P132S, S301L, V204A, R60C, V261F, P108L, L50F, Q189K, A266V, T190I, V68L, C160F, S267L, P99L, T169I, A191V"
19,nsp7,3,83.0,0.03614457831325301,0.001,0.47,"M75I, L17F, S26F"
20,nsp9,2,113.0,0.017699115044247787,0.001,0.722,"K36N, M101I"
